{
  "subject": "physics",
  "course": null,
  "curriculum_version": "DP Physics first assessment 2025",
  "first_assessment": 2025,
  "sources": [
    {"title":"IB DP Subject Alignment Study: Physics (May 2025), Figure 2","url":"https://www.ibo.org/globalassets/new-structure/research/pdfs/physics-subject-report.pdf"}
  ],
  "topics": [
    {"code":"A.1","title":"Kinematics","parent":"A. Space, time and motion","level":["SL","HL"],"keywords":["displacement","velocity","acceleration","projectile","kinematics"],"concepts":["motion graph","equations of motion"],"exclusions":[],"legacy_topic_mappings":["2.1 Motion"]},
    {"code":"A.2","title":"Forces and momentum","parent":"A. Space, time and motion","level":["SL","HL"],"keywords":["newton law","momentum","impulse","collision","force"],"concepts":["free-body diagram","conservation of momentum"],"exclusions":["centripetal force only"],"legacy_topic_mappings":["2.2 Forces","2.4 Momentum and impulse"]},
    {"code":"A.3","title":"Work, energy and power","parent":"A. Space, time and motion","level":["SL","HL"],"keywords":["work done","kinetic energy","potential energy","power","efficiency"],"concepts":["energy conservation","mechanical work"],"exclusions":[],"legacy_topic_mappings":["2.3 Work, energy and power"]},
    {"code":"A.4","title":"Rigid body mechanics","parent":"A. Space, time and motion","level":["HL"],"keywords":["torque","moment of inertia","angular momentum","rotational equilibrium","rigid body"],"concepts":["rotation","rolling motion"],"exclusions":[],"legacy_topic_mappings":["6.1 Circular motion"]},
    {"code":"A.5","title":"Galilean and special relativity","parent":"A. Space, time and motion","level":["HL"],"keywords":["special relativity","lorentz factor","time dilation","length contraction","spacetime"],"concepts":["galilean transformation","relativistic energy"],"exclusions":["redshift only"],"legacy_topic_mappings":["Option A Relativity"]},
    {"code":"B.1","title":"Thermal energy transfers","parent":"B. The particulate nature of matter","level":["SL","HL"],"keywords":["specific heat capacity","latent heat","conduction","convection","thermal energy"],"concepts":["temperature change","phase change"],"exclusions":["greenhouse effect"],"legacy_topic_mappings":["3.1 Thermal concepts"]},
    {"code":"B.2","title":"Greenhouse effect","parent":"B. The particulate nature of matter","level":["SL","HL"],"keywords":["greenhouse effect","emissivity","black body","stefan-boltzmann","albedo"],"concepts":["radiative balance","climate forcing"],"exclusions":[],"legacy_topic_mappings":["8.2 Thermal energy transfer"]},
    {"code":"B.3","title":"Gas laws","parent":"B. The particulate nature of matter","level":["SL","HL"],"keywords":["ideal gas","gas law","PV=nRT","kinetic theory","pressure volume"],"concepts":["molecular model of gases","equation of state"],"exclusions":["thermodynamic cycle"],"legacy_topic_mappings":["3.2 Modelling a gas"]},
    {"code":"B.4","title":"Thermodynamics","parent":"B. The particulate nature of matter","level":["HL"],"keywords":["first law of thermodynamics","entropy","carnot","heat engine","PV diagram"],"concepts":["thermodynamic process","cycle efficiency"],"exclusions":[],"legacy_topic_mappings":["Option B Engineering physics"]},
    {"code":"B.5","title":"Current and circuits","parent":"B. The particulate nature of matter","level":["SL","HL"],"keywords":["electric current","resistance","kirchhoff","circuit","electromotive force"],"concepts":["potential difference","electrical power","internal resistance"],"exclusions":["charged particle trajectory"],"legacy_topic_mappings":["5.2 Heating effect of electric currents","5.3 Electric cells"]},
    {"code":"C.1","title":"Simple harmonic motion","parent":"C. Wave behaviour","level":["SL","HL"],"keywords":["simple harmonic motion","oscillation","angular frequency","restoring force","amplitude"],"concepts":["periodic motion","energy in SHM"],"exclusions":[],"legacy_topic_mappings":["4.1 Oscillations","9.1 Simple harmonic motion"]},
    {"code":"C.2","title":"Wave model","parent":"C. Wave behaviour","level":["SL","HL"],"keywords":["wavelength","wave speed","transverse","longitudinal","wavefront"],"concepts":["travelling wave","intensity"],"exclusions":[],"legacy_topic_mappings":["4.2 Travelling waves","4.3 Wave characteristics"]},
    {"code":"C.3","title":"Wave phenomena","parent":"C. Wave behaviour","level":["SL","HL"],"keywords":["interference","diffraction","refraction","polarization","superposition"],"concepts":["path difference","critical angle","resolution"],"exclusions":["standing wave only"],"legacy_topic_mappings":["4.4 Wave behaviour","9.2 Single-slit diffraction","9.3 Interference","9.4 Resolution"]},
    {"code":"C.4","title":"Standing waves and resonance","parent":"C. Wave behaviour","level":["SL","HL"],"keywords":["standing wave","resonance","node","antinode","harmonic"],"concepts":["boundary conditions","natural frequency"],"exclusions":[],"legacy_topic_mappings":["4.5 Standing waves"]},
    {"code":"C.5","title":"Doppler effect","parent":"C. Wave behaviour","level":["SL","HL"],"keywords":["doppler effect","frequency shift","redshift","moving source","moving observer"],"concepts":["wavefront spacing","relative motion"],"exclusions":[],"legacy_topic_mappings":["9.5 Doppler effect"]},
    {"code":"D.1","title":"Gravitational fields","parent":"D. Fields","level":["SL","HL"],"keywords":["gravitational field","gravitational potential","orbit","escape speed","kepler"],"concepts":["inverse square field","orbital energy"],"exclusions":[],"legacy_topic_mappings":["6.2 Newton's law of gravitation","10.1 Describing fields","10.2 Fields at work"]},
    {"code":"D.2","title":"Electric and magnetic fields","parent":"D. Fields","level":["SL","HL"],"keywords":["electric field","magnetic field","coulomb","electric potential","magnetic flux density"],"concepts":["field strength","equipotential","force between charges"],"exclusions":["induced emf"],"legacy_topic_mappings":["5.1 Electric fields","5.4 Magnetic effects of electric currents","10.1 Describing fields"]},
    {"code":"D.3","title":"Motion in electromagnetic fields","parent":"D. Fields","level":["SL","HL"],"keywords":["charged particle","lorentz force","velocity selector","mass spectrometer","circular path"],"concepts":["particle deflection","crossed fields"],"exclusions":["orbital gravitation"],"legacy_topic_mappings":["5.4 Magnetic effects of electric currents"]},
    {"code":"D.4","title":"Induction","parent":"D. Fields","level":["HL"],"keywords":["faraday law","lenz law","induced emf","magnetic flux linkage","transformer"],"concepts":["electromagnetic induction","alternating current"],"exclusions":[],"legacy_topic_mappings":["11.1 Electromagnetic induction","11.2 Power generation and transmission"]},
    {"code":"E.1","title":"Structure of the atom","parent":"E. Nuclear and quantum physics","level":["SL","HL"],"keywords":["atomic energy level","emission spectrum","rutherford","mass defect","binding energy"],"concepts":["nuclear structure","spectral lines"],"exclusions":["chemical electron configuration"],"legacy_topic_mappings":["7.1 Discrete energy and radioactivity","12.1 The interaction of matter with radiation"]},
    {"code":"E.2","title":"Quantum physics","parent":"E. Nuclear and quantum physics","level":["HL"],"keywords":["photoelectric effect","de broglie","wavefunction","quantum tunnelling","uncertainty principle"],"concepts":["matter waves","quantization"],"exclusions":[],"legacy_topic_mappings":["12.1 The interaction of matter with radiation"]},
    {"code":"E.3","title":"Radioactive decay","parent":"E. Nuclear and quantum physics","level":["SL","HL"],"keywords":["radioactive decay","half-life","decay constant","alpha decay","beta decay"],"concepts":["random decay","activity"],"exclusions":["nuclear reactor"],"legacy_topic_mappings":["7.1 Discrete energy and radioactivity","12.2 Nuclear physics"]},
    {"code":"E.4","title":"Fission","parent":"E. Nuclear and quantum physics","level":["SL","HL"],"keywords":["nuclear fission","chain reaction","critical mass","nuclear reactor","control rod"],"concepts":["energy release","neutron multiplication"],"exclusions":[],"legacy_topic_mappings":["7.2 Nuclear reactions","8.1 Energy sources"]},
    {"code":"E.5","title":"Fusion and stars","parent":"E. Nuclear and quantum physics","level":["SL","HL"],"keywords":["nuclear fusion","stellar evolution","main sequence","hertzsprung-russell","luminosity"],"concepts":["stellar nucleosynthesis","mass-luminosity relation"],"exclusions":[],"legacy_topic_mappings":["7.2 Nuclear reactions","Option D Astrophysics"]}
  ]
}
