{
  "subject": "chemistry",
  "course": null,
  "curriculum_version": "DP Chemistry first assessment 2025",
  "first_assessment": 2025,
  "sources": [
    {
      "title": "IB DP Subject Alignment Study: Chemistry (May 2025), Figure 2",
      "url": "https://www.ibo.org/globalassets/new-structure/research/pdfs/chemistry-subject-report.pdf"
    }
  ],
  "topics": [
    {"code":"Structure 1.1","title":"Introduction to the particulate nature of matter","parent":"Structure 1. Models of the particulate nature of matter","level":["SL","HL"],"keywords":["particle model","element","compound","mixture","state of matter"],"concepts":["particulate matter","physical change","chemical change"],"exclusions":[],"legacy_topic_mappings":["Topic 1 Stoichiometric relationships"]},
    {"code":"Structure 1.2","title":"The nuclear atom","parent":"Structure 1. Models of the particulate nature of matter","level":["SL","HL"],"keywords":["isotope","mass spectrum","atomic number","mass number","nucleus"],"concepts":["proton","neutron","relative atomic mass","mass spectrometry"],"exclusions":["nuclear fission"],"legacy_topic_mappings":["Topic 2 Atomic structure"]},
    {"code":"Structure 1.3","title":"Electron configurations","parent":"Structure 1. Models of the particulate nature of matter","level":["SL","HL"],"keywords":["electron configuration","orbital","emission spectrum","ionization energy","aufbau"],"concepts":["energy levels","subshells","successive ionization energies"],"exclusions":[],"legacy_topic_mappings":["Topic 2 Atomic structure"]},
    {"code":"Structure 1.4","title":"Counting particles by mass: The mole","parent":"Structure 1. Models of the particulate nature of matter","level":["SL","HL"],"keywords":["mole","avogadro","molar mass","empirical formula","molecular formula"],"concepts":["amount of substance","stoichiometric amount","percentage composition"],"exclusions":[],"legacy_topic_mappings":["Topic 1 Stoichiometric relationships"]},
    {"code":"Structure 1.5","title":"Ideal gases","parent":"Structure 1. Models of the particulate nature of matter","level":["SL","HL"],"keywords":["ideal gas","gas law","PV=nRT","molar volume","partial pressure"],"concepts":["kinetic molecular theory","pressure","temperature","volume"],"exclusions":[],"legacy_topic_mappings":["Topic 1 Stoichiometric relationships"]},
    {"code":"Structure 2.1","title":"The ionic model","parent":"Structure 2. Models of bonding and structure","level":["SL","HL"],"keywords":["ionic bond","ionic lattice","lattice enthalpy","ion","electrostatic attraction"],"concepts":["ionic structure","ionic properties"],"exclusions":[],"legacy_topic_mappings":["Topic 4 Chemical bonding and structure"]},
    {"code":"Structure 2.2","title":"The covalent model","parent":"Structure 2. Models of bonding and structure","level":["SL","HL"],"keywords":["covalent bond","lewis structure","VSEPR","hybridization","sigma bond","pi bond"],"concepts":["molecular geometry","bond polarity","intermolecular forces"],"exclusions":["reaction mechanism"],"legacy_topic_mappings":["Topic 4 Chemical bonding and structure"]},
    {"code":"Structure 2.3","title":"The metallic model","parent":"Structure 2. Models of bonding and structure","level":["SL","HL"],"keywords":["metallic bond","delocalized electrons","alloy","metal lattice"],"concepts":["electrical conductivity","malleability"],"exclusions":["electrolysis"],"legacy_topic_mappings":["Topic 4 Chemical bonding and structure"]},
    {"code":"Structure 2.4","title":"From models to materials","parent":"Structure 2. Models of bonding and structure","level":["SL","HL"],"keywords":["polymer","addition polymer","condensation polymer","nanomaterial","composite"],"concepts":["structure-property relationship","materials"],"exclusions":[],"legacy_topic_mappings":["Topic 4 Chemical bonding and structure","Topic 10 Organic chemistry"]},
    {"code":"Structure 3.1","title":"The periodic table: Classification of elements","parent":"Structure 3. Classification of matter","level":["SL","HL"],"keywords":["periodic trend","atomic radius","electronegativity","periodicity","transition metal"],"concepts":["periodic table","successive ionization energy","oxidation state"],"exclusions":[],"legacy_topic_mappings":["Topic 3 Periodicity","Topic 13 The periodic table—the transition metals"]},
    {"code":"Structure 3.2","title":"Functional groups: Classification of organic compounds","parent":"Structure 3. Classification of matter","level":["SL","HL"],"keywords":["functional group","homologous series","IUPAC","isomer","infrared spectrum","NMR"],"concepts":["organic nomenclature","spectroscopy","structural isomerism"],"exclusions":["reaction mechanism"],"legacy_topic_mappings":["Topic 10 Organic chemistry","Topic 20 Organic chemistry"]},
    {"code":"Reactivity 1.1","title":"Measuring enthalpy changes","parent":"Reactivity 1. What drives chemical reactions?","level":["SL","HL"],"keywords":["enthalpy change","calorimetry","specific heat capacity","exothermic","endothermic"],"concepts":["energy transfer","reaction enthalpy"],"exclusions":[],"legacy_topic_mappings":["Topic 5 Energetics/thermochemistry"]},
    {"code":"Reactivity 1.2","title":"Energy cycles in reactions","parent":"Reactivity 1. What drives chemical reactions?","level":["SL","HL"],"keywords":["hess law","born-haber","bond enthalpy","formation enthalpy","combustion enthalpy"],"concepts":["energy cycle","lattice enthalpy"],"exclusions":[],"legacy_topic_mappings":["Topic 5 Energetics/thermochemistry","Topic 15 Energetics/thermochemistry"]},
    {"code":"Reactivity 1.3","title":"Energy from fuels","parent":"Reactivity 1. What drives chemical reactions?","level":["SL","HL"],"keywords":["fuel","combustion","biofuel","fuel cell","energy density"],"concepts":["energy resources","environmental impact"],"exclusions":[],"legacy_topic_mappings":["Topic 5 Energetics/thermochemistry"]},
    {"code":"Reactivity 1.4","title":"Entropy and spontaneity","parent":"Reactivity 1. What drives chemical reactions?","level":["HL"],"keywords":["entropy","gibbs free energy","spontaneous","delta G","standard entropy"],"concepts":["thermodynamic feasibility","disorder"],"exclusions":[],"legacy_topic_mappings":["Topic 18.2 Entropy and spontaneity"]},
    {"code":"Reactivity 2.1","title":"How much? The amount of chemical change","parent":"Reactivity 2. How much, how fast and how far?","level":["SL","HL"],"keywords":["stoichiometry","limiting reagent","percentage yield","atom economy","titration"],"concepts":["reaction equation","amount of product","solution concentration"],"exclusions":[],"legacy_topic_mappings":["Topic 1 Stoichiometric relationships"]},
    {"code":"Reactivity 2.2","title":"How fast? The rate of chemical change","parent":"Reactivity 2. How much, how fast and how far?","level":["SL","HL"],"keywords":["rate of reaction","rate equation","activation energy","arrhenius","reaction order","catalyst"],"concepts":["collision theory","rate constant","mechanism kinetics"],"exclusions":[],"legacy_topic_mappings":["Topic 6 Chemical kinetics","Topic 16 Chemical kinetics"]},
    {"code":"Reactivity 2.3","title":"How far? The extent of chemical change","parent":"Reactivity 2. How much, how fast and how far?","level":["SL","HL"],"keywords":["equilibrium constant","reaction quotient","le chatelier","dynamic equilibrium","Kc"],"concepts":["equilibrium position","extent of reaction"],"exclusions":[],"legacy_topic_mappings":["Topic 7 Equilibrium","Topic 17 Equilibrium"]},
    {"code":"Reactivity 3.1","title":"Proton transfer reactions","parent":"Reactivity 3. What are the mechanisms of chemical change?","level":["SL","HL"],"keywords":["acid","base","pH","buffer","pKa","proton transfer"],"concepts":["bronsted-lowry","neutralization","acid-base equilibrium"],"exclusions":["amino acid structure only"],"legacy_topic_mappings":["Topic 8 Acids and bases","Topic 18 Acids and bases"]},
    {"code":"Reactivity 3.2","title":"Electron transfer reactions","parent":"Reactivity 3. What are the mechanisms of chemical change?","level":["SL","HL"],"keywords":["redox","oxidation","reduction","electrochemical cell","electrolysis","standard electrode potential"],"concepts":["electron transfer","voltaic cell","electrolytic cell"],"exclusions":[],"legacy_topic_mappings":["Topic 9 Redox processes","Topic 19 Redox processes"]},
    {"code":"Reactivity 3.3","title":"Electron sharing reactions","parent":"Reactivity 3. What are the mechanisms of chemical change?","level":["SL","HL"],"keywords":["free radical substitution","homolytic fission","radical","addition reaction","organic reaction"],"concepts":["electron sharing mechanism","reaction pathway"],"exclusions":["bonding structure only"],"legacy_topic_mappings":["Topic 10 Organic chemistry"]},
    {"code":"Reactivity 3.4","title":"Electron-pair sharing reactions","parent":"Reactivity 3. What are the mechanisms of chemical change?","level":["SL","HL"],"keywords":["nucleophile","electrophile","curly arrow","heterolytic fission","substitution mechanism","elimination mechanism"],"concepts":["electron-pair movement","organic mechanism"],"exclusions":["functional group identification only"],"legacy_topic_mappings":["Topic 20 Organic chemistry"]}
  ]
}
